<?xml version="1.0" encoding="ISO-8859-1"?>
<!DOCTYPE base SYSTEM "contrainte.dtd">
<base>
  <restaurant nom="la tour d'argent" etoile="3" ville="Paris"> 
    <fermeture>dimanche et lundi</fermeture>
    <menu nom="gourmet" prix="300"/>
  </restaurant>

  <ville nom="Paris" departement="75">
    <plusBeauMonument nom="tour Eiffel" tarif="30"/>
  </ville>

  <restaurant nom="chez Bocuse" etoile="2" ville="Lyon">
    <fermeture>dimanche</fermeture>
    <menu nom="spécialités lyonnaises" prix="200"/>
    <menu nom="végétarien" prix="299"/>
  </restaurant>

  <restaurant nom="MacDo" etoile="0" ville="Marseille">
    <menu nom="standard" prix="35"/>
    <menu nom="enfant" prix="20"/>
    <menu nom="big" prix="49"/>
  </restaurant>

  <ville nom="Lyon" departement="69">
  </ville>

  <ville nom="Avignon" departement="84">
    <plusBeauMonument nom="le pont" tarif="30"/>
  </ville>

</base>
